### ISSUE TITLE
Pulling manifest fails with error "read: connection reset by peer"

### ISSUE THREAD

**Issue by chopeen** [ollama/ollama#3452]
### What is the issue?

After upgrading from `0.1.27` to `0.1.30`, I can no longer pull models when connected to a corporate network:

```
$ ollama pull codellama

pulling manifest 
Error: pull model manifest: Get "https://ollama.com/token?nonce=VV5GsyYSIqo_4gO3ILCHrA&scope=repository%!A(MISSING)library%!F(MISSING)codellama%!A(MISSING)pull&service=ollama.com&ts=1712050312": read tcp 10.144.68.189:56764->34.120.132.20:443: read: connection reset by peer
```

### What did you expect to see?

The model `codellama` should be pulled and saved locally.

### Steps to reproduce

1. Connect to corporate network
2. Run `ollama pull ...` or `ollama run ...` for any model not present locally

### Are there any recent changes that introduced the issue?

It used to work in December.

I downgraded and tested two Ollama versions from the past - both `0.1.24` and `0.1.27` are able to pull models on the corporate network. The issue appeared in version `0.1.28`.

### OS

Linux

### Architecture

x86

### Ollama version

0.1.30

### GPU info

No GPU

### CPU

Intel

**Comment by chopeen** [comment]
I captured the traffic with Wireshark:

```
250	31.770536460	10.144.68.189	34.120.132.20	TLSv1.2	336	Client Hello
251	31.817286137	34.120.132.20	10.144.68.189	TLSv1.2	1350	Server Hello
252	31.817286328	34.120.132.20	10.144.68.189	TCP	1350	443 → 56764 [ACK] Seq=1285 Ack=271 Win=524032 Len=1284 TSval=1780638996 TSecr=743213469 [TCP segment of a reassembled PDU]
253	31.817286341	34.120.132.20	10.144.68.189	TCP	1350	443 → 56764 [ACK] Seq=2569 Ack=271 Win=524032 Len=1284 TSval=1780638996 TSecr=743213469 [TCP segment of a reassembled PDU]
254	31.817286355	34.120.132.20	10.144.68.189	TLSv1.2	554	Certificate, Server Key Exchange, Server Hello Done
255	31.817352245	10.144.68.189	34.120.132.20	TCP	66	56764 → 443 [ACK] Seq=271 Ack=1285 Win=64128 Len=0 TSval=743213516 TSecr=1780638996
256	31.817357662	10.144.68.189	34.120.132.20	TCP	66	56764 → 443 [ACK] Seq=271 Ack=2569 Win=63232 Len=0 TSval=743213516 TSecr=1780638996
257	31.817359342	10.144.68.189	34.120.132.20	TCP	66	56764 → 443 [ACK] Seq=271 Ack=3853 Win=62208 Len=0 TSval=743213516 TSecr=1780638996
258	31.817363546	10.144.68.189	34.120.132.20	TCP	66	56764 → 443 [ACK] Seq=271 Ack=4341 Win=61824 Len=0 TSval=743213516 TSecr=1780638996
259	31.818124543	10.144.68.189	34.120.132.20	TLSv1.2	192	Client Key Exchange, Change Cipher Spec, Encrypted Handshake Message
262	31.855122846	34.120.132.20	10.144.68.189	TLSv1.2	117	Change Cipher Spec, Encrypted Handshake Message
263	31.855603585	10.144.68.189	34.120.132.20	TLSv1.2	489	Application Data
264	31.893609863	34.120.132.20	10.144.68.189	TCP	66	443 → 56764 [RST, ACK] Seq=4392 Ack=820 Win=523776 Len=0 TSval=1780639072 TSecr=743213554
265	31.894373918	10.144.68.189	104.21.75.227	TLSv1.2	97	Encrypted Alert
```

Details for the frame 264:

![image](https://github.com/ollama/ollama/assets/183731/3a7e196a-329c-4054-af01-dd09cc778797)

**Comment by chopeen** [comment]
A configuration change was implemented in the aforementioned corporate network, so I am no longer able to reproduce this issue and help testing any potential changes.

**Comment by fzyabc** [comment]
Can the author teach me how to downgrade

**Comment by chopeen** [comment]
The details depend on your OS and how you install Ollama, but in general under Releases you can find old Ollama versions, e.g. https://github.com/ollama/ollama/releases/tag/v0.1.27.

**Comment by fzyabc** [comment]
> 详细信息取决于您的操作系统和安装 Ollama 的方式，但通常在“版本”下，您可以找到旧的 Ollama 版本，例如 https://github.com/ollama/ollama/releases/tag/v0.1.27。

Thank you so much!Solved,It's because of the version problem.,Download version 0.1.27 no problem.

**Comment by mjdacs** [comment]
Since the security vuln and subsequent patch in 0.1.34 I now get this error message again.
